jurisdiction,country_code,unique_id,region,income_group,population,level,year_imp,date_imp,last_update,update_detail,instrument,structure,basis_specific,basis_advalorem,products,carbonates,concentrates,energy_drinks,juice_unsweetened,juice_sweetened,milk_drinks,lcsb,water_unsweetened,exclusions,tiered,basis_tiers,bev,sug,pom,swe,threshold,rate,targeted,health_obj,earmarked,indexed,legislation,url_1,url_2,url_3,notes,evaluation1,evaluation2,evaluation3,,,,,,,,,,,,,,,,,,,,,,,,,,,,,,,,,,,,,,,,,
Niger,NER,NER,AFR,LIC,26207977,National,2015,2015-05-27,N/I,N/A,Excise,Ad valorem,N/A,Ex-factory or CIF value,"Non-alcoholic beverages, including fruit juice (HS headings 2202 and 2009), excluding water; Extracts, essences or concentrates of tea and coffee (HS2101)",1,1,1,1,1,1,1,0,Plain water,1,BEV,1,0,0,0,0,"15% on non-alcoholic beverages under HS heading 2202.10 and HS 22.02.90, 10% on extracts, essences and concentrates of tea and coffee (HS 21.01)",1,0,0,N/A,Loi no. 2019-76 du 31 décembre 2019 portant loi de finances pour l´année budgétaire 2020; Loi 2015-38 modifiant la Code Général des Impôts,https://www.impots.gouv.ne/media/loi/2020.pdf,,,,,,,,,,,,,,,,,,,,,,,,,,,,,,,,,,,,,,,,,,,,,,,
Nigeria,NGA,NGA,AFR,LMIC,218541212,National,2021,2021-12-31,N/I,N/A,Excise,Specific,Volume,N/A,Non-alcoholic carbonated and sugar-sweetened beverages,1,0,1,0,0,0,1,0,Unsweetened and non-carbonated beverages,0,N/A,0,0,0,0,0,"NGN 10/L on non-alcoholic, carbonated and sugar-sweetened beverages",1,1,0,0,"Finance Act 2021, amending the Customs, Excise Tariffs, etc (Consolidated) Act, 2004 (“CETA”); Excise Duty (Non-Alcoholic, Carbonated and Sweetened Beverages) Regulations, 2022",https://firs.gov.ng/wp-content/uploads/2022/04/Finance-Act-2021-Gazetted.pdf ,,,,,,,,,,,,,,,,,,,,,,,,,,,,,,,,,,,,,,,,,,,,,,,
Niue,NIU,NIU,EAP,N/C,N/A,National,1969,1969-01-01,2016-07-01,Rate increased from 60% to 80% in 2016,Import,Ad valorem,N/A,Import value ,Sweetened beverages (HS2202) excluding flavored water and flavored milk,1,0,1,0,0,0,1,0,"Plain water, flavored water, flavored milk",0,N/A,0,0,0,0,0,"80% on sweetened beverages under HS2202, excluding flavored water and flavored milk",1,1,0,N/A,Customs Tariff Order 1969; Customs Tariff Act 1982; Customs and Tariff (General Amendment) Regulations 2016,https://niue.tradeportal.org/media/Reg%202016-04%20Niue%20Customs%20and%20Tarriff%20(General%20Amendment)%20Regulations%202016.PDF ,,,,,,,,,,,,,,,,,,,,,,,,,,,,,,,,,,,,,,,,,,,,,,,
Northern Mariana Islands,MNP,MNP,EAP,HIC,49551,National,1995,1995-01-01,N/I,N/A,Excise,Specific,Volume,N/A,"Soft drinks, meaning ""any readily drinkable carbonated or non-carbonated nonalcoholic beverage, other than drinkable dairy products, 100% fruit or vegetable juices, and bottled drinking water""",1,0,1,0,1,0,1,0,"Milk-based drinks, water, 100% juices",0,N/A,0,0,0,0,0,"US$0.005 per fl oz on nonalcoholic beverages, excluding milk-based drinks, 100% fruit or vegetable juices, and unsweetened water",1,0,0,0,"Public Law No. 9-22, Ch 4, Art 2, 1994 ",https://www.cnmilaw.org/pdf/public_laws/09/pl09-22.pdf ,,,,,,,,,,,,,,,,,,,,,,,,,,,,,,,,,,,,,,,,,,,,,,,
"Oakland, USA",USA,USA4,NAR,HIC,N/A,City/County,2017,2017-07-01,N/I,N/A,Excise,Specific,Volume,N/A,"Any beverage to which one or more caloric sweeteners have been added and that contain ≥25 kcals per 12 fluid ounces of beverage and include sodas, sports drinks, sweetened teas, and energy drinks ",1,1,1,0,1,0,0,0,"Milk-based drinks, LCSB, 100% fruit and/or vegetable juice ",0,N/A,0,0,0,0,1,"US¢1 per ounce on any beverage to which one or more caloric sweeteners have been added and that contain ≥25 kcals per 12 fluid ounces of beverage, excluding milk-based drinks",1,1,1,0,"Ord No. 86161, Sugar Sweetened Beverage Product Distribution Tax",https://cao-94612.s3.amazonaws.com/documents/86161-CMS.pdf ,,,,,,,,,,,,,,,,,,,,,,,,,,,,,,,,,,,,,,,,,,,,,,,
Oman ,OMN,OMN,MENA,HIC,4576298,National,2019,2019-06-15,2020-10-01,Rate increased and extended to cover all SSB in 2020 (previously applied only to carbonated and energy drinks),Excise,Ad valorem,N/A,Ex-factory or CIF value,"All types of juices, sports drinks, fruit/malt syrups, pre-mixed ready to serve coffee and tea drinks, which “contains sugar or any of its derivatives” (regardless of the percentage of sugar contained). Concentrates, powders, gels, extracts or “any other forms” that can be converted into sweetened drinks.",1,1,1,0,1,0,1,0,"Unsweetened waters, 100% juice, milk and other dairy products that contain at least 75% milk ",1,BEV,1,0,0,0,0,"50% on all ready-to-drink beverages that contain added sugar or other sweeteners as well as concentrates, powder, gel, or extracts intended to be made into an SSB; 100% on energy drinks",1,1,0,N/A,National Excise Tax Law Decree 23/2019,https://tms.taxoman.gov.om/portal/web/taxportal/excise ,,,,,,,,,,,,,,,,,,,,,,,,,,,,,,,,,,,,,,,,,,,,,,,
Pakistan,PAK,PAK,SAR,LMIC,235824862,National,2005,2005-07-01,2023-03-01,"Federal Excise Duty (FED) rate on carbonated beverages increased from 8% to 13% in 2019. FED on juices withdrawn in 2021. FED on flavored milk and yoghurt-based drinks increased from 10% to 17% in 2022. FED on carbonated beverages increased to 20% and 10% FED imposed on fruit juices, syrups, and squashes, and waters whether or not containing added sugar or artificial sweeteners excluding mineral and aerated water on 1 March 2023. ",Excise,Ad valorem,N/A,Ex-factory or CIF value,"Waters whether or not containing added sugar or artificial sweeteners excluding mineral water; flavored milk and yoghurt; sugary fruit juices, syrups and squashes",1,1,1,1,1,1,1,1,None,1,BEV,1,0,0,0,0,"20% on aerated waters containing added sugar or other sweetening matter or flavored; 17% on flavored milk and yoghurt-based drinks; 10% on fruit juices, syrups and squashes, and waters whether or not containing added sugar or artificial sweeteners excluding mineral and aerated water",1,0,0,N/A,"Federal Excise Act, 2005; Finance Supplementary Act, 2023",https://www.fbr.gov.pk/finance-supplementary-act/173791,https://www.fbr.gov.pk/Downloads/?id=88445&Type=Docs,,,,,,,,,,,,,,,,,,,,,,,,,,,,,,,,,,,,,,,,,,,,,,
Palau,PLW,PLW,EAP,UMIC,18055,National ,2003,2003-09-01,N/I,N/A,Import,Mixed,Volume,Import value ,"Carbonated soft drinks under HS heading 2202, bottled water ",1,0,1,0,0,0,1,1,"Juices, non-carbonated SSB",0,N/A,0,0,0,0,0,$0.10 per 12 fl. oz. on carbonated soft drinks under HS2202; 25% ad valorem on bottled water,0,0,0,0,"Palau National Code, Title 40, Chapter 13, § 1301 - Imposition of import tax; Palau Customs Tariff Schedule HS2012",https://www.palaugov.pw/wp-content/uploads/2022/04/Palau-National-Code-Title-40.pdf ,http://www.palaucustoms.org/files/common_unit_id/bd748d15-e25c-4d6b-b972-ec097decea29/Palau%20HS%202012.pdf,,,,,,,,,,,,,,,,,,,,,,,,,,,,,,,,,,,,,,,,,,,,,,
Panama,PAN,PAN,LAC,HIC,4408581,National,1995,1995-11-14,2019-11-18,Rates increased in 2019 ,Excise,Ad valorem,N/A,Retail sale price,Nonalcoholic beverages containing added sugar or sweeteners and concentrated syrups,1,1,1,0,1,0,1,0," Dairy, grain, and cereal-based beverages, natural fruit juices and concentrates, or products with <7.5 g sugar per 100 ml",1,BEV,1,0,0,0,0,7% on carbonated SSB; 5% on other nonalcoholic SSB; 10% on syrups and concentrates used to produce sugary drinks,1,0,0,N/A,"Ley N 45, 14 nov 1995; Ley N 114 of 18 nov 2019",https://docs.panama.justia.com/federales/leyes/45-de-1995-nov-15-1995.pdf ,https://www.gacetaoficial.gob.pa/pdfTemp/28903_A/GacetaNo_28903a_20191118.pdf ,https://www.gacetaoficial.gob.pa/gacetas/22911_1995.pdf ,,,,,,,,,,,,,,,,,,,,,,,,,,,,,,,,,,,,,,,,,,,,,
Paraguay,PRY,PRY,LAC,UMIC,6780744,National,1992,1992-01-09,2015-12-01,"Rate lowered from 8% to 5% in Dec 2015. Proposal to increase rate to 20% presented to Congress in 2018, not passed. ",Excise,Ad valorem,N/A,Ex-factory or CIF value,Soda and beverages - sweetened or not - without alcohol or with a maximum of 2 percent alcohol; juice of fruits with a maximum of 2 percent alcohol,1,1,1,1,1,1,1,1,None,0,N/A,0,0,0,0,0,5% on all non-alcoholic beverages,0,0,0,N/A,Ley N 5538/15; Ley N 125/91,https://www.mspbs.gov.py/dependencias/dnvs/adjunto/308cb1-LEYN55382015QUEMODIFICAELRGIMENTRIBUTARIODELTABACO.pdf ,,,,,,,,,,,,,,,,,,,,,,,,,,,,,,,,,,,,,,,,,,,,,,,
Peru ,PERU,PER,LAC,UMIC,34049588,National,1999,1999-04-15,2021-09-01,"From April 1999 to Dec 2006, 19% applied to consumption of specific ""luxury"" goods, including carbonated soda and bottled water (carbonated and non-carbonated) . On 29 Dec 2006, bottled water was made exempt from the ISC, and non-carbonated soft drinks, energy drinks, and sports drinks were added to the list of products covered by the tax . All dairy-based drinks and juices remained exempt. In May 2018, rate increased from 17% to 25% on all SSB (including non-alcoholic beer) containing 6g sugar or more per 100 ml. In June 2019, rate lowered from 17% to 12%  for SSBs containing 0.5 g sugar or less per 100 ml. In Sept 2021, upper threshold was lowered to 5 grams sugar/100ml. ",Excise,Ad valorem,N/A,Retail sale price,"Nonalcoholic beverages, sweetened waters, and 0% alcohol beer ",1,1,1,1,1,1,1,0,"Plain water, 100% juice, plain milk, drinkable yoghurts (incl. sweetened)",1,SUGAR  ,0,1,0,0,0,"25% on beverages with ≥6 g sugar per 100 ml, 17% on drinks with 0.5-6g sugar per 100ml, 12% on drinks with <0.5g sugar per 100ml. Applies to all sweetened beverages excluding drinkable yoghurts and 100% juice",1,1,0,N/A,"Impuesto Selectivo al Consumo (ISC) introduced by Titulo II - Decreto Supremo N 055-99-EF, April, 15, 1999; Decreto Supremo 216-2006-EF; Decreto Supremo N 091-2018-EF, 9 May 2018; Supreme Decree 266-2021-EF",https://cdn.www.gob.pe/uploads/document/file/40385/DS091_2018EF.pdf ,https://cdn.www.gob.pe/uploads/document/file/250486/225875_file20181218-16260-cpfyeh.pdf ,https://www.globalfoodresearchprogram.org/wp-content/uploads/2022/03/Peru-SSB-Tax-Law-2019-Revision-EN-TRANSLATION.pdf ,https://www.globalfoodresearchprogram.org/wp-content/uploads/2022/03/Peru-SSB-Tax-Law-2018-EN-TRANSLATION-SCG.pdf ,,,,,,,,,,,,,,,,,,,,,,,,,,,,,,,,,,,,,,,,,,,,
"Philadelphia, USA",USA,USA5,NAR,HIC,N/A,City/County,2017,2017-07-01,N/I,N/A,Excise,Specific,Volume,N/A,"Any nonalcoholic beverage with caloric sugar-based sweetener or artificial sugar substitute listed as an ingredient, including soda, non-100% fruit and vegetable drinks, sports drinks, flavored water, energy drinks, pre-sweetened coffee or tea, and nonalcoholic beverages intended to be mixed into an alcoholic drink; also, syrups or other concentrates used in beverages (incl. coffee syrups distributed to coffee shops), pre-packaged beverages made with “natural” sweeteners, such as agave, honey, or stevia. Any non-alcoholic beverage that lists as an ingredient:  any form of caloric sugar-based sweetener, including, but not limited to, sucrose, glucose or high fructose corn syrup; or  any form of artificial sugar substitute, including stevia, aspartame, sucralose, neotame, acesulfame potassium (Ace-K), saccharin, and advantame.  Any non-alcoholic syrup or other concentrate that is intended to be used in the preparation of a beverage and that lists as an ingredient: any form of caloric sugar-based sweetener, including, but not limited to, sucrose, glucose or high.fructose corn syrup; or  any form of artificial sugar substitute, including stevia, aspartame, sucralose, neotame, acesulfame potassium (Ace-K), saccharin,  and advantame.",1,1,1,0,1,0,1,0,"Milk-based drinks, 100% fruit and/or vegetable juices",0,N/A,0,0,0,0,0,"US¢1.5 per ounce on all nonalcoholic beverages containing caloric sugar-based sweetener or artificial sugar substitute, including soda, non-100% fruit and vegetable drinks, sports drinks, flavored water, energy drinks, pre-sweetened coffee or tea, concentrtes, and nonalcoholic beverages intended to be mixed into an alcoholic drink.",1,1,1,0,"Sugar Sweetened Beverage Tax, Bill No. 160176",https://www.phila.gov/media/20170808092824/Sweetened-Bev-Tax-Regs-Comp-8-4-2017-final.pdf ,,,,Zhong et al 2018,Roberto et al 2019,,,,,,,,,,,,,,,,,,,,,,,,,,,,,,,,,,,,,,,,,,
Philippines ,PHL,PHL,EAP,LMIC,115559009,National,2018,2018-01-01,N/I,N/A,Excise,Specific,Volume,N/A,"Beverages made with caloric and non-caloric sweeteners, including sweetened juice drinks, sweetened tea, all carbonated beverages, flavoured water,energy and sports drinks, powdered drinks not classified as milk, juice, tea or coffee, cereal and grain beverages, and other non-alcoholic beverages that contain added sugar.
",1,1,1,0,1,0,1,0,"All milk products whether sweetened or not, including plain milk, infant formula milk, follow-on milk, growing-up milk, powdered milk, ready-to-drink milk, flavoured milk, fermented milk, soy milk and flavoured soy milk;100% natural fruit and vegetables juices without added sugar or caloric sweeteners; meal-replacement and medically indicated beverages; ground coffee, instant soluble coffee and prepackaged powdered coffee products; and beverages sweetened with coconut sap or stevia glycosides.",1,SWE,0,0,0,1,0,"PHP 6 per liter on drinks containing sugar and artificial sweeteners; PHP 12 per liter on drinks containing HFCS, excluding milk-based drinks and 100% juices",1,1,0,0," Tax Reform for Acceleration and Inclusion (TRAIN) Law, Republic Act No. 10963 of 24th July 2017",https://taxreform.dof.gov.ph/tax-reform-packages/p1-train/ ,https://www.bir.gov.ph/index.php/tax-information/excise-tax.html,,,,,,,,,,,,,,,,,,,,,,,,,,,,,,,,,,,,,,,,,,,,,,
Poland,POL,POL,ECA,HIC,37561599,National,2021,2021-01-01,N/I,N/A,Excise,Specific,Sugar+Volume,N/A,"Non-alcoholic drinks containing added sugar or artificial sweeteners, caffeine or taurine",1,1,1,0,1,0,1,0,"Sports/isotonic drinks with sugar content less than or equal to 5g sugar/100mL, juice products with content of no less than 20 per cent of fruit or vegetable juice with max. sugar content of 5 g/100 ml, and beverages with milk or milk products as the first/primary ingredient are exempt. Juice drinks with at least 20% juice content and isotonic sports drinks that exceed the sugar limit (of 5g sugar/100mL) are not charged the base fee of PLN 0.5 per L.",1,"BEV, SUGAR",1,1,0,0,0,PLN 0.50 per liter on drinks containing <5g sugar per 100ml. Additional PLN 0.05 per gram of sugar >5g/100ml. Additional PLN 0.09 per L on drinks containing caffeine or taurine. Total soda fee cannot exceed PLN 1.2 per L. ,1,1,0,0,Ustawa z dnia 14 lutego 2020 r. o zmianie niektórych ustaw w związku z promocją prozdrowotnych wyborów konsumentów [Amending certain acts in connection with the promotion of health-promoting choices of consumers],https://isap.sejm.gov.pl/isap.nsf/DocDetails.xsp?id=WDU20200001492 ,,,,,,,,,,,,,,,,,,,,,,,,,,,,,,,,,,,,,,,,,,,,,,,
Portugal,PRT,PRT,ECA,HIC,10379007,National,2017,2017-01-01,N/I,N/A,Excise,Specific,Volume,N/A,"Mineral, flavored, and aerated waters containing added sugar or sweeteners covered by HS 2202, concentrates",1,1,1,0,0,0,1,0,"Juices and nectars; drinks based on milk, soy or rice, ",1,SUGAR  ,0,1,0,0,0,8.22€/hl on SSB containing <80 g sugar/l; 16.46€/hl on SSB containing  ≥80 g sugar/l. Applies to beverages under HS 2202 and concentrates,1,1,1,0,"Diário da República nº 248/2016 Série I de 2016-12-28. Lei 42/2016. Orçamento do Estado para 2017. Secção III. Impostos especiais de consumo. Artigo 211. Imposto sobre o álcool, as bebidas alcoólicas e as bebidas adicionadas de açúcar ou outros edulcorantes (IABA). 2016 Dec 28. Artigo 247.º do/a Lei n.º 114/2017 - Diário da República n.º 249/2017, Série I de 2017-12-29, em vigor a partir de 2018-01-01. Lei n.º 24-D/2022, de 30 de dezembro",https://dre.pt/dre/legislacao-consolidada/decreto-lei/2010-34478675-105757237 ,,,,,,,,,,,,,,,,,,,,,,,,,,,,,,,,,,,,,,,,,,,,,,,
Qatar,QAT,QAT,MENA,HIC,2695122,National,2019,2019-01-01,N/I,N/A,Excise,Ad valorem,N/A,Retail sale price," Any aerated beverage (except unflavoured aerated water) such as carbonated water with added sugar, other sweeteners or flavours. Also includes concentrates, powder, gel or extracts intended to be made into an aerated beverage",1,1,1,0,0,0,1,0,"Non-flavored aerated water, non-carbonated sweetened beverages, coffee and tea",1,BEV,1,0,0,0,0,50% on carbonated sweetened drinks and concentrates intended to be made into carbonated drinks; 100% on energy drinks ,1,1,0,N/A,Law No. 25 of 2018 concerning excise tax,https://www.customs.gov.qa/arabic/pages/default.aspx ,https://gta.gov.qa/wp-content/uploads/2018/08/Excise-Tax-Law-2018-1.pdf?csrt=11549591233939583914 ,https://gta.gov.qa/ar/excise-tax-ar/ ,,,,,,,,,,,,,,,,,,,,,,,,,,,,,,,,,,,,,,,,,,,,,
Romania,ROU,ROU,ECA,HIC,18956666,National,2023,2023-01-01,N/I,N/A,VAT/GST,Ad valorem,N/A,N/A,"Beverages under HS headings 2202 10, and 2202 99",1,0,1,0,0,0,1,0,"Juices, milk, unsweetened waters",0,N/A,0,0,0,0,0,"19% (standard VAT rate) on beverages under HS headings 2202 10, and 2202 99. Reduced rate (9%) previously applied. ",1,1,0,0,"ORDONANŢĂ nr. 16 din 15 iulie 2022 pentru modificarea şi completarea Legii nr. 227/2015 privind Codul fiscal (Government Ordinance no. 16/2022 (art. 93) of 15 July 2022, amending Law no. 227/2015 regarding the Fiscal Code, published in Official Gazette no. 716/15 VII 2022 ",https://legislatie.just.ro/Public/DetaliiDocument/257589 ,https://gov.ro/ro/guvernul/procesul-legislativ/note-de-fundamentare/nota-de-fundamentare-og-nr-16-15-07-2022&page=1 ,,Reduced (9%) or super-reduced (5%) VAT rates apply to all other food products and non-alcoholic beverages ,,,,,,,,,,,,,,,,,,,,,,,,,,,,,,,,,,,,,,,,,,,,
Russian Federation,RUS,RUS,ECA,UMIC,143555736,National ,2023,2023-07-01,N/I,N/A,Excise,Specific,Volume,N/A,"Drinks sweetened with added sugar, sugar syrup, or honey, with sugar content > 5g per 100ml",1,1,1,0,0,0,0,0,"Juices, juice-containing drinks, nectars, fruit drinks, syrups, milk, dairy products, jelly and (or) plant-based drinks made from cereal grains, legumes, oilseeds, nuts, coconut and (or) products of their processing, with the exception of tonic drinks and drinks that contain carbon dioxide as a component; Drinks with added sugar < 5g per 100ml",0,N/A,0,0,0,0,1,"7 rubles per liter on drinks sweetened with added sugar, sugar syrup, or honey, with sugar content > 5g per 100ml, excluding juice- and milk-based drinks",1,1,1,0,"Order No. ED-7-3/262@ dated 04/19/2023, Amending the Tax Code of the Russian Federation - Налоговый кодекс Российской Федерации (НК РФ), Глава 22, Статья 181 и Статья 193 ( Chapter 22 “Excises”, Art. 181, para 1, subpara 23, and Art. 193, para 1, subpara 40)",https://nalog.garant.ru/fns/nk/eefcaecabb80623c3d3861e5759bd583/ ,https://nalog.garant.ru/fns/nk/ ,,Funds partially earmarked for public health programs (Fight Against Diabetes),,,,,,,,,,,,,,,,,,,,,,,,,,,,,,,,,,,,,,,,,,,,
Rwanda,RWA,RWA,AFR,LIC,13776698,National,2019,2019-09-13,N/I,N/A,Excise,Ad valorem,N/A,Ex-factory or CIF value,"Lemonade, soda, juices",1,1,1,1,1,1,1,1,None,1,BEV,1,0,0,0,0,"39% on lemonade, soda and other non-natural juices, 10% on industrial packed mineral water, 5% on natural fruit and vegetable juices",0,0,0,N/A,Law No. 025/2019 of 13/9/2019 establishing the Excise Duty,https://www.rra.gov.rw/fileadmin/user_upload/new_excise_duty_law__official_gazette__1.pdf,,,,,,,,,,,,,,,,,,,,,,,,,,,,,,,,,,,,,,,,,,,,,,,
Saint Helena,SHN,SHN,AFR,N/C,N/A,National,2014,2014-01-01,2018-01-01,"Rate increased from ₤0.75 per liter to ₤1.00 per liter in 2018, base extended to include fruit juice",Excise,Specific,Volume,N/A,"Carbonated beverages, juices, and concentrates containing ≥15 g sugar per liter ",1,1,1,1,1,0,0,0,"All drinks containing <15g sugar per liter, including LCSBs, plain water",0,N/A,0,0,0,0,1,"₤1.00 per liter on carbonated beverages, juices, and concentrates containing ≥15 g sugar per liter ",1,1,0,0,"Customs & Excise (Tariffs) (Amendment) Regulations, 2018",https://www.sainthelena.gov.sh/wp-content/uploads/2018/04/Appendix-A-Customs-and-Excise.pdf ,,,Sugar tax´ also applies to chocolate and chewing gum at rate of ₤1.00 per kg,,,,,,,,,,,,,,,,,,,,,,,,,,,,,,,,,,,,,,,,,,,,
Saint Kitts and Nevis ,KNA,KNA,LAC,HIC,47657,National,2010,2010-10-26,N/I,N/A,Excise,Ad valorem,N/A,Retail sale price,"Waters, including mineral waters and aerated waters, containing added sugar or other sweetening matter or flavoured (HS 2202), and other nonalcoholic beverages, not including fruit or vegetable juices of heading 20.09; Beverages containing cocoa and malt beverages (HS 2202.90)",1,0,1,0,0,1,1,0,"Plain water, juices (HS 2009)",0,N/A,0,0,0,0,0,"5% on waters, including mineral waters and aerated waters, containing added sugar or other sweetening matter or flavoured under HS heading 2202",1,0,0,N/A,"Excise Tax Act No. 4, 2010",https://eservicesskn.sknird.com/UserFiles/TaxLib/130325054005.pdf ,,,,,,,,,,,,,,,,,,,,,,,,,,,,,,,,,,,,,,,,,,,,,,,
Saint Vincent and the Grenadines,VCT,VCT,LAC,UMIC,103948,National,2007,2007-05-01,N/I,N/A,Excise,Ad valorem,N/A,Retail sale price,"Waters, including mineral waters and aerated waters, containing added sugar or other sweetening matter or flavoured, and other nonalcoholic beverages",1,0,1,0,0,1,1,0,"Plain water, fruit juices",1,BEV,1,0,0,0,0,"5% on carbonated beverages under HS 2202.101, 10% on other beverages under HS Codes 2202.10.90 and 2202.90.10 (Beverages containing cocoa and Other)",1,0,0,N/A,"Excise Tax Act, Chapter 430, Act No. 16 of 2007, amended by SRO 41 of 2007, Act No. 1 of 2008, SRO 63 of 2008, SRO 2 of 2009",https://customs.gov.vc/downloads/act-excise-tax-ch430.pdf,,,,,,,,,,,,,,,,,,,,,,,,,,,,,,,,,,,,,,,,,,,,,,,
Samoa ,WSM,WSM,EAP,LMIC,222382,National,1998,1998-01-01,2018-01-01,"Import duty applied 1984-1998, replaced with excise in 1998.Increased to 36 sene per L in 2006, rate increased 2008, 2012, 2015, 2016, 2018 ",Excise,Specific,Volume,N/A,Waters containing added sugar or other sweetening matter or flavoured under HS 2202,1,0,1,0,0,0,1,0,"Plain water, juices",0,N/A,0,0,0,0,0,52.5 sene per L on waters containing added sugar or other sweetening matter or flavoured under HS heading 2202,1,1,0,0,"Excise Tax Rates Amendment Act 1998, 2006, 2012, 2016, 2018",http://prdrse4all.spc.int/system/files/excise_tax_rate_amendment_act_2008_english_version.pdf ,,,"No automatic adjustment for inflation, but regular adjustments to rate",,,,,,,,,,,,,,,,,,,,,,,,,,,,,,,,,,,,,,,,,,,,
"San Francisco, USA",USA,USA6,NAR,HIC,N/A,City/County,2018,2018-01-01,N/I,N/A,Excise,Specific,Volume,N/A,"Any SSB containing added caloric sweetener and >25 calories per 12 ounces, and syrups and powders that can be made into SSB",1,1,1,0,1,0,0,0,"Milk-based drinks, LCSB, 100% fruit and/or vegetable juice ",0,N/A,0,0,0,0,1,"US¢1 per ounce on any SSB containing added caloric sweetener and >25 calories per 12 ounces, and syrups and powders that can be made into SSB",1,1,1,0,Sugary Drinks Distributor Tax Ordinance,https://sftreasurer.org/business/taxes-fees/sugary-drinks-tax ,,,,,,,,,,,,,,,,,,,,,,,,,,,,,,,,,,,,,,,,,,,,,,,
Sao Tome and Principe,STP,STP,AFR,LMIC,227380,National,1976,1976-06-01,2017-08-01,Ad valorem tax replaced specific tax in 2017 ,Excise,Ad valorem,N/A,Ex-factory or CIF value,"Products under HS2202.10, 2202.90, 2009, 2106.90",1,1,1,1,1,1,1,0,Plain unsweetened water,1,BEV,1,0,0,0,0,"10% on juices (HS 2009) and products under HS 2202.10, 20% on products under HS 2202.90, 20% with 10% surchage on products under HS 2106.90",1,0,0,N/A,Decreto-Lei n.º 20/76 Taxas Imposto de Consumo (1976); Lei n.º 24/X/2017; Diário da II Série de 11 de Agosto de 2017,https://www2.camara.leg.br/saotomeeprincipe/diarios-da-an/x-legislatura/ii-serie/6.a-sessao-legislativa/DAN32-IIS.pdf/view ,,,,,,,,,,,,,,,,,,,,,,,,,,,,,,,,,,,,,,,,,,,,,,,
Saudi Arabia,SAU,SAU,MENA,HIC,36408820,National,2017,2017-01-01,2019-05-15,Base extended in 2019 to cover all SSBs (previously only applied to energy drinks),Excise,Ad valorem,N/A,Retail sale price,All drinks with added sugars ,1,1,1,0,1,0,1,0,"100% juice, milk and dairy products containing at least 75% milk content, dairy alternatives",1,BEV,1,0,0,0,0,100% on energy drinks; 50% on all SSB,1,1,0,N/A,Implementing Regulations for the Excise Tax Law (Selective Tax),https://zatca.gov.sa/ar/pages/default.aspx ,https://zatca.gov.sa/ar/RulesRegulations/Taxes/Documents/اللائحة%20التنفيذية%20للضريبة%20الانتقائية.pdf ,,,,,,,,,,,,,,,,,,,,,,,,,,,,,,,,,,,,,,,,,,,,,,
"Seattle, USA",USA,USA7,NAR,HIC,N/A,City/County,2018,2018-01-01,N/I,N/A,Excise,Specific,Volume,N/A,"Beverages with caloric sweeteners and the syrups and powders used to prepare them, including sodas, energy drinks, fruit drinks, sweetened teas, and ready-to-drink coffee drinks",1,1,1,0,1,0,0,0,"Drinks with <40 kcals per 12 ounce serving, beverages with milk as the principal ingredient or in which water and grains, nuts, legumes, or seeds constitute the first two ingredients in the product ingredient list, 100% natural fruit and vegetable juice, meal replacement beverages, infant formula, and concentrates used in combination with other ingredients to create a beverage",0,N/A,0,0,0,0,1,"For manufacturers grossing more than $5m worldwide: US¢1.75 per ounce on SSB to which one or more added caloric sweeteners has been added and that contains at least 40 calories per 12 oz serving. For manufacturers grossing more than $2 million and less than $5 million in worldwide income: $.01 per ounce, if they have applied for certification from the city. Products made by manufacturers grossing $2K or less in annual income are not taxed, if they have applied for certification from the city.",1,1,1,0,"Ord No. 125324, Sweetened Beverage Tax ",https://www.seattle.gov/license-and-tax-administration/business-license-tax/other-seattle-taxes/sweetened-beverage-tax ,,,,,,,,,,,,,,,,,,,,,,,,,,,,,,,,,,,,,,,,,,,,,,,
